{
  "_generated": "GENERATED by scripts/generate.ts — edit marketplace.config.ts instead",
  "name": "devkit",
  "version": "0.3.0",
  "description": "Engineering-discipline skills for AI coding agents: pinned dev environments, test strategy, clean code, security, and navigable repos",
  "author": {
    "name": "Rahul Muttineni",
    "email": "rahulmutt@gmail.com"
  },
  "homepage": "https://github.com/rahulmutt/devkit",
  "repository": "https://github.com/rahulmutt/devkit",
  "license": "MIT",
  "keywords": [
    "skills",
    "mise",
    "devenv",
    "developer-environment",
    "testing",
    "clean-code",
    "security",
    "documentation"
  ]
}
